{"status":"completed","captured_at":"2026-09-04","source_url":"https://store.steampowered.com/search/?sort_by=Price_ASC&os=win&specials=1&ndl=1&cc=us&l=english&page=1","pages_scanned":20,"results":[{"app_id":1066290,"app_url":"https://store.steampowered.com/app/1066290/_/?snr=1_7_7_2300_150_11","discount_pct":75,"original_price_usd":1.99,"sale_price_usd":0.49},{"app_id":1097550,"app_url":"https://store.steampowered.com/app/1097550/_fantastic_kingdom/?snr=1_7_7_2300_150_15","discount_pct":75,"original_price_usd":1.99,"sale_price_usd":0.49},{"app_id":948770,"app_url":"https://store.steampowered.com/app/948770/2018/?snr=1_7_7_2300_150_3","discount_pct":75,"original_price_usd":1.99,"sale_price_usd":0.49},{"app_id":1028711,"app_url":"https://store.steampowered.com/app/1028711/FateEXTELLA_LINK__Brave_Kings_Surf_Shorts/?snr=1_7_7_2300_150_14","discount_pct":51,"original_price_usd":0.99,"sale_price_usd":0.49},{"app_id":1029412,"app_url":"https://store.steampowered.com/app/1029412/FateEXTELLA_LINK__Black_Elegance/?snr=1_7_7_2300_150_14","discount_pct":51,"original_price_usd":0.99,"sale_price_usd":0.49},{"app_id":1029450,"app_url":"https://store.steampowered.com/app/1029450/FateEXTELLA_LINK__Candy_Pink/?snr=1_7_7_2300_150_14","discount_pct":51,"original_price_usd":0.99,"sale_price_usd":0.49},{"app_id":1031920,"app_url":"https://store.steampowered.com/app/1031920/_/?snr=1_7_7_2300_150_12","discount_pct":51,"original_price_usd":0.99,"sale_price_usd":0.49},{"app_id":1047680,"app_url":"https://store.steampowered.com/app/1047680/_ALILIA/?snr=1_7_7_2300_150_18","discount_pct":51,"original_price_usd":0.99,"sale_price_usd":0.49},{"app_id":1060180,"app_url":"https://store.steampowered.com/app/1060180/Cyber_Driver/?snr=1_7_7_2300_150_14","discount_pct":51,"original_price_usd":0.99,"sale_price_usd":0.49},{"app_id":1060300,"app_url":"https://store.steampowered.com/app/1060300/Homeless_Simulator/?snr=1_7_7_2300_150_18","discount_pct":51,"original_price_usd":0.99,"sale_price_usd":0.49},{"app_id":1069740,"app_url":"https://store.steampowered.com/app/1069740/Seen/?snr=1_7_7_2300_150_12","discount_pct":51,"original_price_usd":0.99,"sale_price_usd":0.49},{"app_id":1070330,"app_url":"https://store.steampowered.com/app/1070330/Russian_Life_Simulator/?snr=1_7_7_2300_150_12","discount_pct":51,"original_price_usd":0.99,"sale_price_usd":0.49},{"app_id":1073220,"app_url":"https://store.steampowered.com/app/1073220/Teeth_Brushing_Simulator/?snr=1_7_7_2300_150_17","discount_pct":51,"original_price_usd":0.99,"sale_price_usd":0.49},{"app_id":1091210,"app_url":"https://store.steampowered.com/app/1091210/Kissing_Simulator/?snr=1_7_7_2300_150_17","discount_pct":51,"original_price_usd":0.99,"sale_price_usd":0.49},{"app_id":1094290,"app_url":"https://store.steampowered.com/app/1094290/_ButterflyRin/?snr=1_7_7_2300_150_19","discount_pct":51,"original_price_usd":0.99,"sale_price_usd":0.49},{"app_id":1144860,"app_url":"https://store.steampowered.com/app/1144860/Flying_Sword/?snr=1_7_7_2300_150_14","discount_pct":51,"original_price_usd":0.99,"sale_price_usd":0.49},{"app_id":1145130,"app_url":"https://store.steampowered.com/app/1145130/_Cute_Bully_Nyanbaba/?snr=1_7_7_2300_150_17","discount_pct":51,"original_price_usd":0.99,"sale_price_usd":0.49},{"app_id":1150620,"app_url":"https://store.steampowered.com/app/1150620/Bed_Lying_Simulator_2020/?snr=1_7_7_2300_150_15","discount_pct":51,"original_price_usd":0.99,"sale_price_usd":0.49},{"app_id":1157310,"app_url":"https://store.steampowered.com/app/1157310/Craft_The_World__Grottoes/?snr=1_7_7_2300_150_13","discount_pct":51,"original_price_usd":0.99,"sale_price_usd":0.49},{"app_id":1184160,"app_url":"https://store.steampowered.com/app/1184160/RUSSIAPHOBIA/?snr=1_7_7_2300_150_15","discount_pct":51,"original_price_usd":0.99,"sale_price_usd":0.49},{"app_id":1191770,"app_url":"https://store.steampowered.com/app/1191770/_Cute_Chaos_Demon_Nyanbaba/?snr=1_7_7_2300_150_17","discount_pct":51,"original_price_usd":0.99,"sale_price_usd":0.49},{"app_id":1216640,"app_url":"https://store.steampowered.com/app/1216640/____Online/?snr=1_7_7_2300_150_15","discount_pct":51,"original_price_usd":0.99,"sale_price_usd":0.49},{"app_id":1243560,"app_url":"https://store.steampowered.com/app/1243560/Vaporwave_World/?snr=1_7_7_2300_150_20","discount_pct":51,"original_price_usd":0.99,"sale_price_usd":0.49},{"app_id":1305350,"app_url":"https://store.steampowered.com/app/1305350/C4/?snr=1_7_7_2300_150_20","discount_pct":51,"original_price_usd":0.99,"sale_price_usd":0.49},{"app_id":1341640,"app_url":"https://store.steampowered.com/app/1341640/Hard_Driver/?snr=1_7_7_2300_150_19","discount_pct":51,"original_price_usd":0.99,"sale_price_usd":0.49},{"app_id":1355400,"app_url":"https://store.steampowered.com/app/1355400/The_Line/?snr=1_7_7_2300_150_16","discount_pct":51,"original_price_usd":0.99,"sale_price_usd":0.49},{"app_id":1392060,"app_url":"https://store.steampowered.com/app/1392060/Erzurum/?snr=1_7_7_2300_150_16","discount_pct":51,"original_price_usd":0.99,"sale_price_usd":0.49},{"app_id":1395560,"app_url":"https://store.steampowered.com/app/1395560/Kandidatos/?snr=1_7_7_2300_150_16","discount_pct":51,"original_price_usd":0.99,"sale_price_usd":0.49},{"app_id":1412580,"app_url":"https://store.steampowered.com/app/1412580/Sword_of_Destiny/?snr=1_7_7_2300_150_17","discount_pct":51,"original_price_usd":0.99,"sale_price_usd":0.49},{"app_id":1415140,"app_url":"https://store.steampowered.com/app/1415140/Kandidatos_Kart/?snr=1_7_7_2300_150_16","discount_pct":51,"original_price_usd":0.99,"sale_price_usd":0.49},{"app_id":1430120,"app_url":"https://store.steampowered.com/app/1430120/Moving_Letters/?snr=1_7_7_2300_150_19","discount_pct":51,"original_price_usd":0.99,"sale_price_usd":0.49},{"app_id":1497020,"app_url":"https://store.steampowered.com/app/1497020/Paint_Girl__Middle_Ages/?snr=1_7_7_2300_150_18","discount_pct":51,"original_price_usd":0.99,"sale_price_usd":0.49},{"app_id":1498590,"app_url":"https://store.steampowered.com/app/1498590/Fat_Prisoner_Simulator_3/?snr=1_7_7_2300_150_14","discount_pct":51,"original_price_usd":0.99,"sale_price_usd":0.49},{"app_id":1503390,"app_url":"https://store.steampowered.com/app/1503390/Drunk_Soccer_is_the_Best_Soccer/?snr=1_7_7_2300_150_15","discount_pct":51,"original_price_usd":0.99,"sale_price_usd":0.49},{"app_id":1508650,"app_url":"https://store.steampowered.com/app/1508650/_/?snr=1_7_7_2300_150_20","discount_pct":51,"original_price_usd":0.99,"sale_price_usd":0.49},{"app_id":1528110,"app_url":"https://store.steampowered.com/app/1528110/Athena_the_rabbit__Jigsaw_Puzzle/?snr=1_7_7_2300_150_20","discount_pct":51,"original_price_usd":0.99,"sale_price_usd":0.49},{"app_id":1534520,"app_url":"https://store.steampowered.com/app/1534520/STRAY_KITTEN/?snr=1_7_7_2300_150_16","discount_pct":51,"original_price_usd":0.99,"sale_price_usd":0.49},{"app_id":1542840,"app_url":"https://store.steampowered.com/app/1542840/PuzzlePet__Feed_your_cat/?snr=1_7_7_2300_150_15","discount_pct":51,"original_price_usd":0.99,"sale_price_usd":0.49},{"app_id":1544510,"app_url":"https://store.steampowered.com/app/1544510/_/?snr=1_7_7_2300_150_16","discount_pct":51,"original_price_usd":0.99,"sale_price_usd":0.49},{"app_id":1548930,"app_url":"https://store.steampowered.com/app/1548930/Viking_Story/?snr=1_7_7_2300_150_19","discount_pct":51,"original_price_usd":0.99,"sale_price_usd":0.49},{"app_id":1553910,"app_url":"https://store.steampowered.com/app/1553910/My_Friend_Stalin/?snr=1_7_7_2300_150_12","discount_pct":51,"original_price_usd":0.99,"sale_price_usd":0.49},{"app_id":1564090,"app_url":"https://store.steampowered.com/app/1564090/Landlord_of_the_Woods/?snr=1_7_7_2300_150_10","discount_pct":51,"original_price_usd":0.99,"sale_price_usd":0.49},{"app_id":1572810,"app_url":"https://store.steampowered.com/app/1572810/_/?snr=1_7_7_2300_150_17","discount_pct":51,"original_price_usd":0.99,"sale_price_usd":0.49},{"app_id":1578220,"app_url":"https://store.steampowered.com/app/1578220/Mister_Furry_Hot_Muscles/?snr=1_7_7_2300_150_7","discount_pct":51,"original_price_usd":0.99,"sale_price_usd":0.49},{"app_id":1579490,"app_url":"https://store.steampowered.com/app/1579490/Dangerous_Chris/?snr=1_7_7_2300_150_18","discount_pct":51,"original_price_usd":0.99,"sale_price_usd":0.49},{"app_id":1596610,"app_url":"https://store.steampowered.com/app/1596610/Dead_Night/?snr=1_7_7_2300_150_20","discount_pct":51,"original_price_usd":0.99,"sale_price_usd":0.49},{"app_id":1598710,"app_url":"https://store.steampowered.com/app/1598710/Wild_world/?snr=1_7_7_2300_150_20","discount_pct":51,"original_price_usd":0.99,"sale_price_usd":0.49},{"app_id":1599250,"app_url":"https://store.steampowered.com/app/1599250/BORIS_RUSSIAN_BEAR/?snr=1_7_7_2300_150_14","discount_pct":51,"original_price_usd":0.99,"sale_price_usd":0.49},{"app_id":1600890,"app_url":"https://store.steampowered.com/app/1600890/_Go_Back_to_Hell/?snr=1_7_7_2300_150_20","discount_pct":51,"original_price_usd":0.99,"sale_price_usd":0.49},{"app_id":1600900,"app_url":"https://store.steampowered.com/app/1600900/_Ghost_Party_Nyanbaba/?snr=1_7_7_2300_150_13","discount_pct":51,"original_price_usd":0.99,"sale_price_usd":0.49}],"limitations":[]}